{
  "id": "RQ-0001",
  "session_id": "run-2025-10-22-so-a",
  "origin": "world_architect",
  "loop_state": "revision",
  "cycle": 2,
  "priority": 3,
  "ttl_cycles": 2,
  "questions": [
    {
      "q": "Could a maintenance bay realistically control station-wide lockdown on a frontier relay?",
      "scope": "factual",
      "must_cite": true,
      "min_sources": 2
    }
  ],
  "version": "1.0.0"
}
